Task Title,Task Description,Category,Priority,Status,Hours Spent,Progress,Deadline,Date Created,Tags,Note
Complete Project Proposal,Write and finalize the quarterly project proposal document,Work,High,Completed,8,100%,2025-10-05,2025-10-01,"urgent important","Submitted ahead of schedule"
Learn Python Advanced Features,Study decorators generators and context managers,Learning,Medium,In Progress,12,60%,2025-10-20,2025-10-10,"study skills","Making good progress daily"
Team Meeting Preparation,Prepare slides and agenda for team meeting,Work,Medium,Completed,3,100%,2025-10-12,2025-10-11,"meeting preparation","Meeting went well"
Database Optimization,Optimize SQL queries and add indexes,Work,High,In Progress,6,40%,2025-10-25,2025-10-15,"technical performance","Identified slow queries"
Client Presentation,Create presentation for client meeting,Work,Critical,Completed,5,100%,2025-10-18,2025-10-14,"client presentation","Client approved the proposal"
Read Technical Book,Finish reading Clean Code book,Learning,Low,Not Started,0,0%,2025-11-05,2025-10-16,"reading improvement","Haven't started yet"
Code Review,Review team member's pull requests,Work,Medium,In Progress,4,80%,2025-10-28,2025-10-20,"review team","2 PRs remaining"
Setup CI/CD Pipeline,Configure continuous integration for new project,Work,High,Completed,6,100%,2025-10-22,2025-10-14,"devops automation","Pipeline is now live"
Update Documentation,Update API documentation for new features,Work,Medium,In Progress,3,50%,2025-10-27,2025-10-21,documentation,"Halfway through endpoints"
Prepare Quarterly Report,Compile data and insights for quarterly report,Work,High,Not Started,0,0%,2025-11-10,2025-10-22,"report analysis","Waiting for final numbers"
Fix Production Bug,Resolve critical bug reported in production,Work,Critical,Completed,4,100%,2025-10-10,2025-10-10,"bugfix critical","Fixed and deployed hotfix"
Team Training Session,Prepare and deliver training on new framework,Work,Medium,In Progress,8,30%,2025-11-02,2025-10-24,"training team","Creating workshop materials"
Research New Technologies,Evaluate new database technologies for migration,Work,Low,Not Started,0,0%,2025-11-20,2025-10-25,"research planning","Scheduled for next quarter"
Update Security Protocols,Implement new security measures,Work,High,In Progress,5,70%,2025-10-29,2025-10-23,security,"Testing phase"
Performance Monitoring,Set up application performance monitoring,Work,Medium,Completed,7,100%,2025-10-21,2025-10-16,"monitoring ops","Dashboards are live"

